{
  "acidcat": "0.1",
  "title": "AcidCat conformance fixture",
  "description": "One capability for each behavior that acid-cat conform tests.",
  "targets": {
    "api": {
      "bindings": [
        "http"
      ]
    },
    "app": {
      "bindings": [
        "typescript",
        "webmcp"
      ]
    },
    "cli": {
      "bindings": [
        "cli"
      ]
    },
    "mcp": {
      "bindings": [
        "mcp"
      ]
    }
  },
  "capabilities": {
    "fixture.crash": {
      "description": "Always fail with a defect.",
      "audience": [
        "app",
        "mcp",
        "cli",
        "api"
      ]
    },
    "fixture.echo": {
      "description": "Return the input text.",
      "audience": [
        "app",
        "mcp",
        "cli",
        "api"
      ],
      "input": {
        "properties": {
          "text": {
            "type": "string"
          }
        },
        "required": [
          "text"
        ],
        "type": "object"
      },
      "output": {
        "properties": {
          "text": {
            "type": "string"
          }
        },
        "required": [
          "text"
        ],
        "type": "object"
      },
      "readOnly": true
    },
    "fixture.flags": {
      "description": "Return the input. The input has one property for each kind of command-line flag.",
      "audience": [
        "cli"
      ],
      "input": {
        "properties": {
          "count": {
            "type": "integer"
          },
          "extra": {
            "type": "object"
          },
          "label": {
            "type": "string"
          },
          "mode": {
            "enum": [
              "fast",
              "slow"
            ],
            "type": "string"
          },
          "ratio": {
            "type": "number"
          },
          "verbose": {
            "type": "boolean"
          }
        },
        "required": [
          "mode"
        ],
        "type": "object"
      },
      "output": {
        "properties": {
          "count": {
            "type": "integer"
          },
          "extra": {
            "type": "object"
          },
          "label": {
            "type": "string"
          },
          "mode": {
            "enum": [
              "fast",
              "slow"
            ],
            "type": "string"
          },
          "ratio": {
            "type": "number"
          },
          "verbose": {
            "type": "boolean"
          }
        },
        "required": [
          "mode"
        ],
        "type": "object"
      }
    },
    "fixture.hidden": {
      "description": "Only the app target can use this capability.",
      "audience": [
        "app"
      ]
    },
    "fixture.refuse": {
      "description": "Always return the failure Refused.",
      "audience": [
        "app",
        "mcp",
        "cli",
        "api"
      ],
      "failures": {
        "Refused": {
          "properties": {
            "_tag": {
              "const": "Refused",
              "type": "string"
            },
            "reason": {
              "type": "string"
            }
          },
          "required": [
            "_tag",
            "reason"
          ],
          "type": "object"
        }
      }
    },
    "fixture.slow": {
      "description": "Wait for some milliseconds, then return null.",
      "audience": [
        "app",
        "mcp",
        "cli",
        "api"
      ],
      "input": {
        "properties": {
          "milliseconds": {
            "type": "number"
          }
        },
        "required": [
          "milliseconds"
        ],
        "type": "object"
      }
    },
    "fixture.switch.set": {
      "description": "Turn the switch on or off. The switch controls the availability of fixture.toggle.",
      "audience": [
        "app",
        "mcp",
        "cli",
        "api"
      ],
      "input": {
        "properties": {
          "on": {
            "type": "boolean"
          }
        },
        "required": [
          "on"
        ],
        "type": "object"
      }
    },
    "fixture.toggle": {
      "description": "Available only while the switch is on.",
      "audience": [
        "app",
        "mcp",
        "cli",
        "api"
      ],
      "input": {
        "properties": {},
        "type": "object"
      }
    }
  }
}
