{"acidcat": "0.1", "title": "Kotlin edge cases: \"quotes\", back\\slash, tab\t, bell\u0007 and \u00e9", "targets": {"z-last": {"bindings": ["kotlin"]}, "a-first": {"bindings": ["http"], "options": {"ratio": 2.5, "tiny": 1e-07, "huge": 1e+21, "whole": 3.0, "negative": -1e-06}}}, "capabilities": {"edge.numbers.get": {"description": "Return numbers: 0.1, 100 and 1e-7.", "audience": ["a-first"], "output": {"type": "object", "properties": {"\u00fc": {"type": "number", "minimum": -1.5, "maximum": 123456789012}, "\u65e5\u672c": {"type": "integer", "multipleOf": 0.25}, "Z": {"const": 1e+300}, "a": {"default": 5e-324}}}}, "edge.strings.get": {"description": "Line one.\nLine two.\u001f\u2028", "audience": ["z-last"], "readOnly": true, "output": {"type": "string", "pattern": "^[a-z]+\\d*$", "examples": ["\ud83d\ude00", "\ud83d\ude00x"], "properties": {"\ud83d\ude00": {"type": "string"}, "\uffee": {"type": "string"}}}}}}